{
  "schema_version": 1,
  "source": "installed_bridge_runtime_snapshot",
  "status": "captured_from_installed_bridge",
  "captured_at": "2026-04-03T00:00:00Z",
  "bound_domain": "wp.electri-c-ity-studios-24-7.com",
  "current_domain": "wp.electri-c-ity-studios-24-7.com",
  "path_base": "/wordpress/",
  "domain_match": true,
  "url_normalization_clean": true,
  "baseline_captured": true,
  "blocking_conflicts": "green",
  "mode": "safe_mode",
  "optimization_gate": "reversible_change_ready",
  "operator_inputs_complete": true,
  "source_mapping_confirmed": true,
  "open_blockers": [],
  "next_smallest_safe_step": "stay in staging, validate the reversible homepage meta preparation path, and keep rollback ready",
  "notes": [
    "Captured from the installed Site Optimizer Bridge runtime.",
    "Reference pilot closeout inputs are recorded in the installed bridge runtime.",
    "stay in staging, validate the reversible homepage meta preparation path, and keep rollback ready"
  ]
}
